{
  "id": "500123",
  "source_id": "500123",
  "name": "Example Name",
  "number": "example_value",
  "status": "active",
  "address": "example_value",
  "start_date": "2025-03-15",
  "estimated_completion_date": "2025-03-15",
  "total_budget": 99.99,
  "created_at": "2025-03-15T14:30:00Z",
  "updated_at": "2025-03-15T14:30:00Z"
}